{
  "ackId": "aaaaaaa1-aaaa-4aaa-8aaa-aaaaaaaaaaa1",
  "messageId": "88888888-8888-4888-8888-888888888888",
  "traceId": "99999999-9999-4999-8999-999999999999",
  "ackType": "accepted",
  "status": "accepted",
  "receivedAt": "2026-06-18T02:40:03Z",
  "ackedAt": "2026-06-18T02:40:03Z",
  "consumer": {
    "component": "AN_VANTARIS_LINK",
    "instanceId": "link-instance-demo-01"
  },
  "details": {
    "retryCount": 0
  }
}
